{
  "$comment": "Requirement IDs: HEE-KIT-02 — worked example: 3 model roles, 12 actions, verify 3 errors → repair → verify 0 errors, one approved approval.",
  "version": "1.0.0",
  "run_id": "example-shelf-run-1",
  "started_at": "2026-10-03T12:00:00.000Z",
  "entries": [
    { "seq": 1, "round": 1, "kind": "model", "name": "planner", "source": "agent", "input_ref": "goal:stock-six-widgets", "output_ref": null, "ok": true, "tokens": { "prompt": 120, "output": 40, "total": 160 }, "latency_ms": 900, "decision": "list_widgets" },
    { "seq": 2, "round": 1, "kind": "action", "name": "list_widgets", "source": "agent", "input_ref": "args#1", "args": {}, "output_ref": "widgets:0", "ok": true, "latency_ms": 12 },
    { "seq": 3, "round": 1, "kind": "model", "name": "actor", "source": "agent", "input_ref": "widgets:0", "output_ref": null, "ok": true, "tokens": { "prompt": 200, "output": 60, "total": 260 }, "latency_ms": 1100, "decision": "add_widget x6" },
    { "seq": 4, "round": 1, "kind": "action", "name": "get_widget", "source": "agent", "input_ref": "args#2", "args": { "name": "alpha" }, "output_ref": "widget:missing", "ok": true, "latency_ms": 8 },
    { "seq": 5, "round": 1, "kind": "action", "name": "add_widget", "source": "agent", "input_ref": "args#3", "args": { "name": "alpha", "shelfId": "shelf-a", "size": 1 }, "output_ref": "widget:alpha", "ok": true, "latency_ms": 15, "state_change": { "revision_before": 0, "revision_after": 1, "entity_ids": ["alpha"] } },
    { "seq": 6, "round": 1, "kind": "action", "name": "add_widget", "source": "agent", "input_ref": "args#4", "args": { "name": "beta", "shelfId": "shelf-a", "size": 1 }, "output_ref": "widget:beta", "ok": true, "latency_ms": 14, "state_change": { "revision_before": 1, "revision_after": 2, "entity_ids": ["beta"] } },
    { "seq": 7, "round": 1, "kind": "action", "name": "add_widget", "source": "agent", "input_ref": "args#5", "args": { "name": "gamma", "shelfId": "shelf-a", "size": 1 }, "output_ref": "widget:gamma", "ok": true, "latency_ms": 14, "state_change": { "revision_before": 2, "revision_after": 3, "entity_ids": ["gamma"] } },
    { "seq": 8, "round": 1, "kind": "action", "name": "add_widget", "source": "agent", "input_ref": "args#6", "args": { "name": "delta", "shelfId": "shelf-a", "size": 1 }, "output_ref": "widget:delta", "ok": true, "latency_ms": 13, "state_change": { "revision_before": 3, "revision_after": 4, "entity_ids": ["delta"] } },
    { "seq": 9, "round": 1, "kind": "action", "name": "add_widget", "source": "agent", "input_ref": "args#7", "args": { "name": "epsilon", "shelfId": "shelf-a", "size": 1 }, "output_ref": "widget:epsilon", "ok": true, "latency_ms": 13, "state_change": { "revision_before": 4, "revision_after": 5, "entity_ids": ["epsilon"] } },
    { "seq": 10, "round": 1, "kind": "action", "name": "add_widget", "source": "agent", "input_ref": "args#8", "args": { "name": "zeta", "shelfId": "shelf-a", "size": 1 }, "output_ref": "widget:zeta", "ok": true, "latency_ms": 13, "state_change": { "revision_before": 5, "revision_after": 6, "entity_ids": ["zeta"] } },
    { "seq": 11, "round": 1, "kind": "action", "name": "check_shelves", "source": "agent", "input_ref": "args#9", "args": {}, "output_ref": "issues:3", "ok": true, "latency_ms": 20, "truth": { "errors": 3, "warnings": 0 } },
    { "seq": 12, "round": 2, "kind": "model", "name": "critic", "source": "agent", "input_ref": "issues:3", "output_ref": null, "ok": true, "tokens": { "prompt": 180, "output": 50, "total": 230 }, "latency_ms": 1000, "decision": "move_widget" },
    { "seq": 13, "round": 2, "kind": "action", "name": "move_widget", "source": "agent", "input_ref": "args#10", "args": { "name": "zeta", "shelfId": "shelf-b" }, "output_ref": "widget:zeta", "ok": true, "latency_ms": 16, "state_change": { "revision_before": 6, "revision_after": 7, "entity_ids": ["zeta"] } },
    { "seq": 14, "round": 2, "kind": "action", "name": "check_shelves", "source": "agent", "input_ref": "args#11", "args": {}, "output_ref": "issues:0", "ok": true, "latency_ms": 19, "truth": { "errors": 0, "warnings": 0 } },
    { "seq": 15, "round": 3, "kind": "approval", "name": "remove_widget", "source": "agent", "input_ref": "args#12", "output_ref": null, "ok": true, "latency_ms": 4500, "decision": "approved" },
    { "seq": 16, "round": 3, "kind": "action", "name": "remove_widget", "source": "agent", "input_ref": "args#12", "args": { "name": "epsilon" }, "output_ref": "removed:epsilon", "ok": true, "latency_ms": 15, "state_change": { "revision_before": 7, "revision_after": 8, "entity_ids": ["epsilon"] } }
  ],
  "summary": {
    "model_calls": 3,
    "actions": 12,
    "rounds": 3,
    "model_roles": ["actor", "critic", "planner"],
    "verify_repair_rounds": 1,
    "human_checkpoints": 1,
    "approvals": { "approved": 1, "rejected": 0 },
    "final_truth": { "errors": 0, "warnings": 0 }
  }
}
